{
  "schema_version": "amy.rg006-contract-test-record.v1-draft",
  "classification": "pre_registration_synthetic_runner_contract_test_not_confirmatory",
  "started_at": "2026-07-14T02:08:12.709083Z",
  "ended_at": "2026-07-14T02:08:13.534789Z",
  "command": [
    "/Volumes/Ganador disk/A.M.Y/experiments/verifiable_release_study/.venv/bin/python",
    "-m",
    "pytest",
    "-q",
    "tests/test_confirmatory_runner_contract.py"
  ],
  "environment": {
    "python": "3.12.12",
    "python_implementation": "CPython",
    "platform": "macOS-26.5.2-arm64-arm-64bit",
    "machine": "arm64"
  },
  "source_inventory": [
    {
      "path": "amy_verifier/confirmatory_runner.py",
      "bytes": 57335,
      "sha256": "6519a50b027635ecabadaa972bd1aa301f225bf9980d73ccacaa251379470719"
    },
    {
      "path": "protocol/CONFIRMATORY_RUNNER_CONTRACT_DRAFT.md",
      "bytes": 13571,
      "sha256": "5d547e1c28ac9c7124b6d33b544a49cb295caac4f31dba917e5029591b883c6f"
    },
    {
      "path": "protocol/RUN_EXECUTION_POLICY_DRAFT.json",
      "bytes": 18600,
      "sha256": "c9da7f8208c5fb38a890407f7787a4e99e57f600f2ae33dcdcdb73cf9f9951a0"
    },
    {
      "path": "pyproject.toml",
      "bytes": 497,
      "sha256": "8d1042a03fe74f320d6b71ee80a05da3e7e190bd64808914c5bf05460ec86af0"
    },
    {
      "path": "schemas/environment-attempt-record.schema.json",
      "bytes": 19285,
      "sha256": "1131d69e94198b561c7aed87b1a2f0ad5e076558999621fec0cd358f830475e2"
    },
    {
      "path": "schemas/infrastructure-classification.schema.json",
      "bytes": 19122,
      "sha256": "529c47e5e2f40a9bc9319cbf37c3be340dd8fdef841f701cc80fabb9787dcd6d"
    },
    {
      "path": "schemas/official-attempt-selection.schema.json",
      "bytes": 19993,
      "sha256": "475578a6e4a9da418529e68f35b79f94f7a67797dd7da01393a68d26cf071786"
    },
    {
      "path": "schemas/process-isolation-record.schema.json",
      "bytes": 11263,
      "sha256": "5d7966c7715e8961ef0fe680a3383368f3669eae88e045d6684a39e8635d385a"
    },
    {
      "path": "schemas/rg006-contract-test-record.schema.json",
      "bytes": 7063,
      "sha256": "b096a7bb883c79d0cd33b1103aab86c2866fd6057a3a32a8a46cdb4413e735a2"
    },
    {
      "path": "schemas/run-execution-policy-validation.schema.json",
      "bytes": 3403,
      "sha256": "da08dceed2adb050b769414df05b48daebc4d0effa1856b3c5d5e4d4d404155c"
    },
    {
      "path": "schemas/run-execution-policy.schema.json",
      "bytes": 21130,
      "sha256": "9e1a1cb731462667331e7ea23200d541d5920517a096913eb80bb1b39b4e97c7"
    },
    {
      "path": "scripts/run_rg006_contract_tests.py",
      "bytes": 9028,
      "sha256": "afffbdf026bf8648eb8c187a3a5766709ccf5df55011499c3b1b64d24961fdb0"
    },
    {
      "path": "scripts/validate_run_execution_policy.py",
      "bytes": 39445,
      "sha256": "3272487527c63d10d78e7799a49a9eae601117d3ce74f935f03ba3f5e5bc0e66"
    },
    {
      "path": "tests/test_confirmatory_runner_contract.py",
      "bytes": 35824,
      "sha256": "94565db5cb6c15b1fb37f30e4c66c5d8c0c03c61b5bac568b4582645e0a400d1"
    },
    {
      "path": "tests/test_run_execution_policy.py",
      "bytes": 9738,
      "sha256": "e75bc09e5a5cee46ff2f30dba7c09807b28c2316140587ce5256f01186505496"
    },
    {
      "path": "uv.lock",
      "bytes": 74227,
      "sha256": "ada446114e2534983167988f875dea92b5d1d895a6a12a9db70e63626a3d9f41"
    }
  ],
  "source_inventory_pre_sha256": "333dc8779cd0f10f82a798c4760d961bb48da7b70cf1e937e77da56d0ab2ab5f",
  "source_inventory_post_sha256": "333dc8779cd0f10f82a798c4760d961bb48da7b70cf1e937e77da56d0ab2ab5f",
  "source_inventory_unchanged_during_execution": true,
  "execution": {
    "exit_code": 0,
    "stdout": ".............................                                            [100%]\n29 passed in 0.36s\n",
    "stdout_sha256": "7088e7f82384ae710f35ea1ab14d13bc71e414163e1cbc6f45116bb980ff832d",
    "stderr": "",
    "stderr_sha256": "e3b0c44298fc1c149afbf4c8996fb92427ae41e4649b934ca495991b7852b855",
    "passed_test_count": 29
  },
  "declared_coverage": {
    "attempt_truth_table_cell_count": 12,
    "required_environment_count": 2,
    "subprocess_contract_tested": true,
    "raw_byte_stream_limits_tested": true,
    "descriptor_and_environment_canaries_tested": true,
    "no_overwrite_tested": true,
    "campaign_selection_tested": true,
    "later_attempt_campaign_seal_tested": true,
    "attempt_process_consistency_tested": true,
    "inherited_capture_pipe_deadline_tested": true,
    "exact_record_hash_recomputation_tested": true,
    "source_inventory_toctou_rejection_tested": true,
    "typed_run_policy_bindings_verified": true,
    "runner_contract_bound_source_count": 15
  },
  "boundaries": {
    "confirmatory_execution_performed": false,
    "confirmatory_outputs_read": false,
    "benchmark_cases_generated": false,
    "oracle_join_performed": false,
    "production_sigstore_conformance_established": false,
    "network_isolation_established": false,
    "full_process_tree_containment_established": false,
    "external_selection_authentication_established": false,
    "independent_review_performed": false
  },
  "decision": "NO-GO",
  "open_controls": [
    "DURABLE_SCIENTIFIC_INTENT_LOG",
    "CAPABILITY_SEPARATED_OUTCOME_VAULT",
    "FULL_PROCESS_TREE_CONTAINMENT",
    "OS_ENFORCED_OFFLINE_BOUNDARY",
    "CRASH_AND_STORAGE_FAULT_INJECTION",
    "BASE_AWARE_CASE_GENERATOR",
    "ALL_PROFILE_CHILD_ADAPTERS",
    "CAMPAIGN_SEAL_TO_LEDGER_LINK",
    "EXTERNAL_SELECTION_AUTHENTICATION",
    "QUALIFIED_INDEPENDENT_HUMAN_REVIEW",
    "R0_FREEZE_AND_REGISTRATION"
  ],
  "rg006_complete": false,
  "manuscript_claims_authorized": false
}
